AverageShortestPathLength,BetweennessCentrality,ClosenessCentrality,ClusteringCoefficient,Degree,Eccentricity,IsSingleNode,Matching.Attribute,name,NeighborhoodConnectivity,NumberOfDirectedEdges,NumberOfUndirectedEdges,PartnerOfMultiEdgedNodePairs,Radiality,selected,SelfLoops,shared name,Stress,TopologicalCoefficient,type
3.6106870229007635,4.010447548220647E-6,0.27695560253699786,0.0,2,6,false,actomyosin contractile ring organization,actomyosin contractile ring organization,34.5,0,2,0,0.968162353379259,false,0,actomyosin contractile ring organization,6,0.6979166666666666,f
3.66793893129771,0.0076335877862595426,0.2726326742976067,0.0,2,7,false,adult feeding behavior,adult feeding behavior,6.5,0,2,0,0.9674641593744181,false,0,adult feeding behavior,9162,0.5,f
3.1412213740458017,0.002576099098723456,0.3183475091130012,0.3333333333333333,3,6,false,triglyceride catabolic process,triglyceride catabolic process,32.333333333333336,0,3,0,0.9738875442189536,false,0,triglyceride catabolic process,1710,0.47761194029850745,f
2.8969465648854964,2.1623892853559436E-4,0.3451910408432147,0.3333333333333333,4,5,false,biological process involved in intraspecies interaction between organisms,biological process involved in intraspecies interaction between organisms,47.0,0,4,0,0.9768665053062744,false,0,biological process involved in intraspecies interaction between organisms,346,0.4538834951456311,f
2.469465648854962,0.008404717617965119,0.40494590417310666,0.09523809523809523,7,5,false,positive regulation of cytosolic calcium ion concentration,positive regulation of cytosolic calcium ion concentration,36.142857142857146,0,7,0,0.9820796872090858,false,0,positive regulation of cytosolic calcium ion concentration,8498,0.2304147465437788,f
